"NPQEZJSG","journalArticle","2018","Demir, Halil İbrahim; Canpolat, Onur; Erden, Caner; Şimşir, Fuat","Process Planning and Scheduling with WNOPPT Weighted Due-Date Assignment where Earliness , Tardiness and Due- Dates are Penalized","Journal of Intelligent Systems: Theory and Applications","","","https://doi.org/10.38016/jista.433085","http://www.jista.info/download/article-file/518698","Process planning, scheduling and due date assignment are three important manufacturing functions in production system in which process planning is input to scheduling processes. Because of rigid process plans, alternative plans are not used that may affect global performance improvement in a bad way. Besides, scheduling without considering process plans causes unbalanced machine loadings and leads to several bottlenecks. In the literature, there are numerous works on process planning and scheduling and works on scheduling with due date assignment. These three functions are not integrated much. According to literature, due dates are assigned without considering weights of the customer. In this study, these three functions are integrated and due dates are given according to the importance of the customers. Eight shop floors are studied. Different levels of integration of these three functions are tested and compared with each other. Two search techniques used which are genetic search and random search and results are compared with ordinary solutions. As the level of integration increased solutions became better and search techniques gave a better result than ordinary solutions and the genetic search outperformed random search.","2018","2018-11-05 07:06:33","2020-07-01 09:26:46","","16–25","","1","1","","","","","","","","","","","CC0 1.0 Universal Public Domain Dedication","","","","Diğer","","","","G:\Drive'ım\Zotero_Attachments\demir_et_al_2018_process_planning_and_scheduling_with.pdf","","process planning; random search; weighted due-date assignment; weighted scheduling; genetic algorithms","","","","","","","","","","","","","","","","","","","","","","","","","","","","","","","","","","","","","","","","","","","","","","",""
"KG2A76U4","journalArticle","2021","Demi̇r, Halil İbrahim; Erden, Caner; Kökçam, Abdullah; Göksu, Alper","A Tabu Search and Hybrid Evolutionary Strategies Algorithms for the Integrated Process Planning and Scheduling with Due-date Agreement","Journal of Intelligent Systems: Theory and Applications","","","10.38016/jista.767154","https://dergipark.org.tr/tr/pub/jista/767154","İmalatın, süreç planlama, çizelgeleme ve teslim tarihinin belirlenmesi olmak üzere üç önemli fonksiyonu bulunmaktadır. Bu fonksiyonları ayrı ayrı gerçekleştirmek yerine, üçünü birlikte değerlendirmek daha gerçekçi ve uygulanabilir planların hazırlanmasına yardımcı olacaktır. Bu problemin çözümünde rassal arama, kısmi tabu, rassal arama/kısmi tabu hibriti, evrimsel stratejiler ve rassal arama/evrimsel stratejiler hibriti yöntemleri kullanılmıştır. Yöntemlerin performansını değerlendirmek amacıyla farklı büyüklükteki atölyeler üzerinde çalışılmıştır. Çalışma sonucunda ayrık çözümler ile entegre çözümler arasındaki farklar ortaya çıkmıştır. Bu fonksiyonların entegrasyonunun toplam performans açısından ve dolayısıyla müşteri memnuniyeti açısından avantajlı olduğu bulunmuştur. Rassal aramanın sıradan çözümlerden daha iyi olduğu görülmüştür. Öte yandan, kısmi tabu, evrimsel stratejiler ve bunların melezleri rassal aramadan daha iyi performans göstermektedir. Hibrit arama yöntemlerinin gelecek vadettiği görülmüştür.","2021-03-24","2021-06-17 12:23:11","2022-08-14 03:11:48","2021-06-17 12:23:11","24-36","","1","4","","","","","","","","","","en","Creative Commons Attribution-NonCommercial-NoDerivatives 4.0 International License (CC-BY-NC-ND)","","","","dergipark.org.tr","","TR-Dizin","","G:\Drive'ım\Zotero_Attachments\demi̇r_et_al_2021_a_tabu_search_and_hybrid_evolutionary.pdf","","","","","","","","","","","","","","","","","","","","","","","","","","","","","","","","","","","","","","","","","","","","","","","","",""
"LTKUEZ33","journalArticle","2021","Demi̇r, Halil İbrahim; Phanden, Rakesh Kumar; Kökçam, Abdullah; Erkayman, Burak; Erden, Caner","Hybrid Evolutionary Strategy and Simulated Annealing Algorithms for Integrated Process Planning, Scheduling and Due-Date Assignment Problem","Academic Platform Journal of Engineering and Science","","","10.21541/apjes.764150","https://dergipark.org.tr/tr/pub/apjes/764150","Bütünleşik süreç planlama ve çizelgeleme (IPPS) problemi ile teslim tarihi belirleme ile çizelgeleme (SWDDA) problemlerinin literatürde kapsamlı olarak kapsamlı olarak çalışılmasına rağmen, süreç planlama, çizelgeleme ve teslim tarihi belirleme fonksiyonlarının bütünleşik çalışılması ile alakalı yalnızca birkaç çalışma vardır. Bütünleşik çalışmalar ile daha iyi bir küresel performans sağlandığından, bu üretim fonksiyonlarının birlikte çalıştırılması önem arz etmektedir. Bu çalışmada, süreç planlama ve en kısa teslim tarihine sahip işlerin önceliklendirildiği (EDD) çizelgeleme kuralı ile teslim tarihi belirleme fonksiyonlarının entegrasyonu, hibrit evrimsel stratejiler (RS/ES) ve hibrit tavlama benzetimi algoritmaları (RS/SA) kullanılarak incelenmiştir. Sıradan çözümler (OS), rasgele arama (RS) çözümleri, evrimsel strateji (ES) çözümleri ve tavlama benzetimi (SA) çözümleri birbirleriyle ve ES ve SA hibrit çözümleri de aralarında karşılaştırılmıştır. Elde edilen sonuçlara göre, daha yüksek bütünleşik çalışmaların daha iyi olduğu ve en iyi sonuçların en yüksek entegrasyon düzeyinde gerçekleştiği tespit edilmiştir. ES ve SA yöntemleri RS ve OS ile karşılaştırıldığında daha iyi sonuçlar vermiştir. Çalışma sonucunda RS/ES ve RS/SA tekniklerinin bütünleşik çalışmalar için kullabılabilir algoritmalar olduğu belirtilmiştir.","2021-01-29","2021-06-17 12:23:51","2022-08-14 03:11:39","2021-06-17 12:23:51","86-91","","1","9","","","","","","","","","","en","Creative Commons Attribution-ShareAlike 4.0 International License (CC-BY-SA)","","","","dergipark.org.tr","","TR-Dizin","","G:\Drive'ım\Zotero_Attachments\demi̇r_et_al_2021_hybrid_evolutionary_strategy_and.pdf","","","","","","","","","","","","","","","","","","","","","","","","","","","","","","","","","","","","","","","","","","","","","","","","",""
"CHKQFZ32","journalArticle","2023","Erden, Caner; Demir, Halil Ibrahim; Canpolat, Onur","A modified integer and categorical PSO algorithm for solving integrated process planning, dynamic scheduling and due date assignment problem","Scientia Iranica","","2345-3605","10.24200/sci.2021.55250.4130","http://scientiairanica.sharif.edu/article_22245.html","","2023","2021-09-03 11:20:42","2023-01-18 16:05:53","2021-09-03 11:20:42","0-0","","0","0","","Scientia Iranica","","","","","","","","en","All rights reserved","","","","DOI.org (Crossref)","","SCI-Q4","","G:\Drive'ım\Zotero_Attachments\erden_et_al_2023_a_modified_integer_and_categorical_pso.pdf; C:\Users\Erden\Zotero\storage\73JSYWUH\Screenshot 2023-01-18 at 19-05-09 Journal Citation Reports - Journal Profile.png","","","","","","","","","","","","","","","","","","","","","","","","","","","","","","","","","","","","","","","","","","","","","","","","",""
"X7BDILV8","journalArticle","2020","Demir, Halil Ibrahim; Erden, Caner","Dynamic integrated process planning, scheduling and due-date assignment using ant colony optimization","Computers & Industrial Engineering","","03608352","10.1016/j.cie.2020.106799","https://linkinghub.elsevier.com/retrieve/pii/S0360835220305064","This paper presents two well-known meta-heuristics which are Genetic Algorithm (GA) and Ant Colony Optimization Algorithm (ACO) to solve the dynamic integrated process planning, scheduling and due date assignment problem (DIPPSDDA) in which jobs arrive to the shop floor randomly. In this study, it is aimed to find the best combination of dispatching rule, due date assignment rule and route of all job with the objective of minimizing earliness, tardiness and due-dates of each jobs. 8 different size shop floors for the comparison of the GA and ACO algorithms performances have been developed. As a result of the experimental study, it was concluded that ACO algorithm outperformed GA algorithm. In addition, it has been suggested that integrated approaches can provide more global manufacturing efficiency than individual approaches.","2020-11","2022-02-10 08:10:04","2023-01-18 16:03:26","2022-02-10 08:10:03","106799","","","149","","Computers & Industrial Engineering","","","","","","","","en","CC0 1.0 Universal Public Domain Dedication","","","","DOI.org (Crossref)","","SCI-Q1","","G:\Drive'ım\Zotero_Attachments\demir_erden_2020_dynamic_integrated_process_planning,.pdf; C:\Users\Erden\Zotero\storage\ZHIWDKWF\Screenshot 2023-01-18 at 19-02-49 Journal Citation Reports - Journal Profile.png","","","","","","","","","","","","","","","","","","","","","","","","","","","","","","","","","","","","","","","","","","","","","","","","",""
"MYRSD9AY","journalArticle","2022","Aksangür, İpek; Eren, Beytullah; Erden, Caner","Evaluation of data preprocessing and feature selection process for prediction of hourly PM10 concentration using long short-term memory models","Environmental Pollution","","02697491","10.1016/j.envpol.2022.119973","https://linkinghub.elsevier.com/retrieve/pii/S0269749122011873","Studies have confirmed that PM10, defined as respirable particles with diameters of 10 μm and smaller, has adverse effects on human health and the environment. Various estimation methods are employed to determine the PM10 concentration using historical data on controlling PM10 air pollution, early warning, and protecting public health and the environment. The present study analyses different Long Short-Term Memory (LSTM) models that can predict hourly PM10 concentration. In parallel, the study also investigates the effectiveness of the data preprocessing and feature selection (DPFS) process on the prediction accuracy of the LSTM models. For this purpose, three different LSTM models, namely Vanilla, Bi-Directional, and Stacked, were developed. Then, a comprehensive data preprocessing stage is used to eliminate missing and erroneous data and outliers from realworld raw data, and a feature selection process is applied to extract unnecessary features. The LSTM models consider three air quality parameters, including SO2, O3, and CO, and three meteorological factors, including relative humidity, wind direction, and wind speed. The prediction performances of the LSTM models are compared using the RMSE, MAE and R2 performance index according to whether DPFS is used in the models or not. As a result, when the DPFS process was applied, the proposed LSTM models achieved high prediction performance and can be used to predict hourly PM10 concentrations. Overall, the DPFS process significantly enhanced the developed LSTM models’ prediction performance. Furthermore, the proposed model might be a useful tool for city administrators to make decisions and improve air quality management efforts.","2022-10","2022-08-20 06:22:40","2023-01-18 16:01:01","2022-08-20 06:22:40","119973","","","311","","Environmental Pollution","","","","","","","","en","All rights reserved","","","","DOI.org (Crossref)","","SCI-Q1","","G:\Drive'ım\Zotero_Attachments\aksangür_et_al_2022_evaluation_of_data_preprocessing_and.pdf; C:\Users\Erden\Zotero\storage\N98SJD3C\Screenshot 2023-01-18 at 19-00-25 Journal Citation Reports - Journal Profile.png","","","","","","","","","","","","","","","","","","","","","","","","","","","","","","","","","","","","","","","","","","","","","","","","",""
"DHNFVUDV","journalArticle","2022","Ozsagir, Mustafa; Erden, Caner; Bol, Ertan; Sert, Sedat; Özocak, Aşkın","Machine learning approaches for prediction of fine-grained soils liquefaction","Computers and Geotechnics","","0266352X","10.1016/j.compgeo.2022.105014","https://linkinghub.elsevier.com/retrieve/pii/S0266352X22003512","Since soil liquefaction is a dimension that increases the amount and severity of losses in an earthquake, it is vital to estimate the liquefaction potential accurately. Traditionally, several analytical inferences were made for the prediction of soil liquefaction. However, it is necessary to use machine learning methods to establish nonlinear relationships of soil physical characteristics and develop an accurate classification model. In this study, the applicability of seven different machine learning algorithms; decision trees, logistic regression, support vector machines, k-nearest neighbors, stochastic gradient descent, random forest, and artificial neural network, were investigated on a data set obtained from field experiments (Standard Penetration Test) on soils in Adapazari region after the 1999 earthquake. Performance metrics such as accuracy, recall, precision, F1 score, and receiver operating characteristic evaluated algorithms. As a result of experimental studies, the decision tree algorithm performed best on the dataset, with an overall accuracy of 90%. The decision tree model provides an easy and effective tool for evaluating ground liquefaction potential to decision-makers. As a result of the decision tree study, it was observed that the mean grain size (D50) soil feature has the most significant effect on the lique­ faction potential.","2022-12","2022-09-16 08:40:41","2023-01-18 16:01:08","2022-09-16 08:40:41","105014","","","152","","Computers and Geotechnics","","","","","","","","en","All rights reserved","","","","DOI.org (Crossref)","","SCI-Q1","","G:\Drive'ım\Zotero_Attachments\ozsagir_et_al_2022_machine_learning_approaches_for.pdf; C:\Users\Erden\Zotero\storage\CGQEYQC8\Screenshot 2023-01-18 at 19-01-52 Journal Citation Reports - Journal Profile.png","","","","","","","","","","","","","","","","","","","","","","","","","","","","","","","","","","","","","","","","","","","","","","","","",""
"IKWF989D","journalArticle","2021","Koç, Serkan; Erden, Caner","Green Supply Chain Management in the Context of Sustainability","Journal of Business and Trade","","","","","For centuries, humanity has seen nature as an unlimited resource, despised it, they polluted it. Hence, that caused environmental problems. On the one hand, the rapidly increasing population phenomenon, the existence of natural resources that are running out has made it necessary to seek new solutions for humanity. The solution put forward in this framework is the understanding of sustainable development, which can be summarized as ensuring that natural resources are transferred to future generations without completely consuming them. The priority in sustainable development approach has been the sustainability of the natural environment. With the increasing awareness of the international community and states, production systems and processes are revised and transition to green practices that will minimize environmental damage has rapidly gained importance. A traditional supply chain is a one-way process that involves productionrelated activities from raw material procurement to delivery of the final product. Due to environmental requirements affecting production operations today, an increasing emphasis is placed on the development of environmental management strategies for the supply chain. In this study, green approaches, and green supply chain management (GSCM) are considered conceptually, and the green activities implemented and the obstacles in front of them are evaluated. A general perspective is put forward to ensure and maintain the green supply chain.","2021","2023-01-06 12:50:55","2023-01-18 15:55:25","","1-11","","1","2","","","","","","","","","","en","","","","","Zotero","","","","G:\Drive'ım\Zotero_Attachments\koç_erden_2021_green_supply_chain_management_in_the.pdf","","","⛔ No DOI found","","","","","","","","","","","","","","","","","","","","","","","","","","","","","","","","","","","","","","","","","","","","","",""
"NXMRMJ5V","journalArticle","2023","Eren, Beytullah; Aksangür, İpek; Erden, Caner","Predicting next hour fine particulate matter (PM2.5) in the Istanbul Metropolitan City using deep learning algorithms with time windowing strategy","Urban Climate","","2212-0955","10.1016/j.uclim.2023.101418","https://www.sciencedirect.com/science/article/pii/S2212095523000123","Poor air quality has various detrimental physical and mental effects on human health and quality of life. In particular, PM2.5 air pollution has been associated with cardiovascular and respiratory problems. Therefore, air quality management is an essential issue for densely populated cities to reduce or prevent the adverse effects of air pollution. Considering this, reliable models for predicting pollution levels for pollutants like PM2.5 are critical tools for decision-making. For this purpose, this study presents three kinds of deep learning (DL) algorithms (LSTM, RNN, and GRU) that utilize a time-windowing strategy to predict the hourly concentration of PM2.5 in the Istanbul metropolitan. The models were trained and tested using large data sets that envelope air quality parameters (PM2.5, SO2, NO, NO2, NOX, and O3) and meteorological factors (temperature, wind speed, relative humidity, and air pressure) for about five years. The experimental results demonstrate that the LSTM+LSTM model performs significantly better with an R2 of 0.98 and 0.97 at the significance level (p < 0.05) for training and test sets compared to other deep learning algorithms. In addition, data for one year from several stations located in nine different districts of Istanbul were used to evaluate the proposed model's generalization ability. As a result, the proposed LSTM+LSTM model has a good generalization ability with an R2 accuracy rate of 0.90 (p < 0.05) and above for all stations and can be used for non-linear, non-stationary multidimensional time series data. Furthermore, the results were compared to other studies in the literature; it was found that the proposed LSTM+LSTM model performed better in predicting PM2.5 concentrations.","2023-03-01","2023-01-11 19:57:23","2023-01-18 16:04:31","","101418","","","48","","Urban Climate","","","","","","","","","","","","","","","SCI-Q1","","G:\Drive'ım\Zotero_Attachments\eren_2023_predicting_next_hour_fine_particulate.pdf; C:\Users\Erden\Zotero\storage\HL82Z3LX\Screenshot 2023-01-18 at 19-04-08 Journal Citation Reports - Journal Profile.png","","","Deep learning; ⚠️ Invalid DOI; Fine particulate matter (PM); Gated recurrent unit (GRU); Long-short term memory (LSTM); Recurrent neural network (RNN); Time windowing","","","","","","","","","","","","","","","","","","","","","","","","","","","","","","","","","","","","","","","","","","","","","",""
"CYV8MMUX","journalArticle","2019","Erden, Caner; Demir, Halil Ibrahim; Kökçam, Abdullah Hulusi","Solving Integrated Process Planning, Dynamic Scheduling, and Due Date Assignment Using Metaheuristic Algorithms","Mathematical Problems in Engineering","","1024-123X, 1563-5147","10.1155/2019/1572614","https://www.hindawi.com/journals/mpe/2019/1572614/","Because the alternative process plans have significant contributions to the production efficiency of a manufacturing system, researchers have studied the integration of manufacturing functions, which can be divided into two groups, namely, integrated process planning and scheduling (IPPS) and scheduling with due date assignment (SWDDA). Although IPPS and SWDDA are well-known and solved problems in the literature, there are limited works on integration of process planning, scheduling, and due date assignment (IPPSDDA). In this study, due date assignment function was added to IPPS in a dynamic manufacturing environment. And the studied problem was introduced as dynamic integrated process planning, scheduling, and due date assignment (DIPPSDDA). The objective function of DIPPSDDA is to minimize earliness and tardiness (E/T) and determine due dates for each job. Furthermore, four different pure metaheuristic algorithms which are genetic algorithm (GA), tabu algorithm (TA), simulated annealing (SA), and their hybrid (combination) algorithms GA/SA and GA/TA have been developed to facilitate and optimize DIPPSDDA on the 8 different sized shop floors. The performance comparisons of the algorithms for each shop floor have been given to show the efficiency and effectiveness of the algorithms used. In conclusion, computational results show that the proposed combination algorithms are competitive, give better results than pure metaheuristics, and can effectively generate good solutions for DIPPSDDA problems.","2019-05-30","2023-01-18 15:56:50","2023-01-18 16:07:25","2023-01-18 15:56:50","1-19","","","2019","","Mathematical Problems in Engineering","","","","","","","","en","","","","","DOI.org (Crossref)","","SCI-Q3","","G:\Drive'ım\Zotero_Attachments\erden_et_al_2019_solving_integrated_process_planning,.pdf; C:\Users\Erden\Zotero\storage\Y5IK5RIL\Screenshot 2023-01-18 at 18-58-20 Journal Citation Reports - Journal Profile.png","","","","","","","","","","","","","","","","","","","","","","","","","","","","","","","","","","","","","","","","","","","","","","","","",""
"5UA3NY3S","journalArticle","2023","Erden, C.","Genetic algorithm-based hyperparameter optimization of deep learning models for PM2.5 time-series prediction","International Journal of Environmental Science and Technology","","1735-2630","10.1007/s13762-023-04763-6","https://doi.org/10.1007/s13762-023-04763-6","Since air pollution negatively affects human health and causes serious diseases, accurate air pollution prediction is essential regarding environmental sustainability. Although conventional statistical and machine learning methods have been widely used for air quality forecasting, they have limitations in finding nonlinear relations and modeling sequential data. In recent years, deep learning methods such as long short-term memory, recurrent neural networks, and gated recurrent units have been successfully applied in several research areas, including time-series forecasting. In this study, deep learning algorithm is employed to predict the PM2.5 dataset, including air pollutants (NO, NO2, NOX, O3, PM2.5, SO, and SO2) and meteorological features (wind speed, wind direction, and air temperature) in Istanbul metropolitan. Deep learning algorithms have many hyperparameters such as learning and dropout rate, the number of hidden layers and units in each hidden layer, activation function, loss function, and optimizer that need to be optimized in order to achieve optimal training performance. Therefore, a genetic algorithm-based hyperparameter optimization approach is proposed to find the best parameter combination. The prediction results of deep learning algorithms are compared with default hyperparameters and random search algorithms to confirm the efficacy of the genetic algorithm approach. The proposed method outperforms the other configurations, with the MSE error reduced by 13.38% and 55.30% for testing performance, respectively. The experimental results revealed that genetic algorithms are promising and applicable in hyperparameter optimization of deep neural network models, especially in air quality forecasting.","2023-01-25","2023-01-25 17:36:18","2023-01-25 17:40:26","2023-01-25 17:36:18","","","","","","Int. J. Environ. Sci. Technol.","","","","","","","","en","","","","","Springer Link","","Q3","","G:\Drive'ım\Zotero_Attachments\erden_2023_genetic_algorithm-based_hyperparameter.pdf","","","Recurrent neural networks; Hyperparameter optimization; Particulate matter; Genetic algorithms; Gated recurrent units; Long-short term memory","","","","","","","","","","","","","","","","","","","","","","","","","","","","","","","","","","","","","","","","","","","","","",""
"NMPNG56K","journalArticle","2017","Demir, Halil Ibrahim; Erden, Caner; Demiriz, Ayhan; Dugenci, Muharrem; Uygun, Ozer","Integrating Process Planning, WATC Weighted Scheduling, and WPPW Weighted Due-Date Assignment Using Pure and Hybrid Metaheuristics for Weighted Jobs","International Journal of Computational and Experimental Science and Engineering","","2149-9144","10.22399/ijcesen.323860","https://dergipark.org.tr/en/doi/10.22399/ijcesen.323860","","2017-06-28","2023-01-26 03:29:13","2023-01-26 03:30:21","2023-01-26 03:29:13","11-20","","1","3","","","","","","","","","","","","","","","DOI.org (Crossref)","","","","G:\Drive'ım\Zotero_Attachments\demir_et_al_2017_integrating_process_planning,_watc2.pdf","","","","","","","","","","","","","","","","","","","","","","","","","","","","","","","","","","","","","","","","","","","","","","","","",""